{
  "schema_version": 1,
  "request_id": "thal-irem-ti-fade",
  "job_kind": "batch",
  "target": "batch_rxbkg_state1_mech1/net_newsec_ee_fade_var_seed",
  "template_path": "hpc_jobs/templates/batch.sh",
  "expected_result_path": "exp_results/batch_rxbkg_state1_mech1/net_newsec_ee_fade_var_seed/exp_thal_irem_ti_fade_nseed_15_t_7.0_10.0_wmult_0.25_ee_0.5",
  "completion_files": [
    "jobs/index.jsonl",
    "results/result_00000_seed_1000.json",
    "rasters/raster_00000_seed_1000.png",
    "cfg/cfg_00000_seed_1000.json",
    "results/result_00001_seed_1001.json",
    "rasters/raster_00001_seed_1001.png",
    "cfg/cfg_00001_seed_1001.json",
    "results/result_00002_seed_1002.json",
    "rasters/raster_00002_seed_1002.png",
    "cfg/cfg_00002_seed_1002.json",
    "results/result_00003_seed_1003.json",
    "rasters/raster_00003_seed_1003.png",
    "cfg/cfg_00003_seed_1003.json",
    "results/result_00004_seed_1004.json",
    "rasters/raster_00004_seed_1004.png",
    "cfg/cfg_00004_seed_1004.json",
    "results/result_00005_seed_1005.json",
    "rasters/raster_00005_seed_1005.png",
    "cfg/cfg_00005_seed_1005.json",
    "results/result_00006_seed_1006.json",
    "rasters/raster_00006_seed_1006.png",
    "cfg/cfg_00006_seed_1006.json",
    "results/result_00007_seed_1007.json",
    "rasters/raster_00007_seed_1007.png",
    "cfg/cfg_00007_seed_1007.json",
    "results/result_00008_seed_1008.json",
    "rasters/raster_00008_seed_1008.png",
    "cfg/cfg_00008_seed_1008.json",
    "results/result_00009_seed_1009.json",
    "rasters/raster_00009_seed_1009.png",
    "cfg/cfg_00009_seed_1009.json",
    "results/result_00010_seed_1010.json",
    "rasters/raster_00010_seed_1010.png",
    "cfg/cfg_00010_seed_1010.json",
    "results/result_00011_seed_1011.json",
    "rasters/raster_00011_seed_1011.png",
    "cfg/cfg_00011_seed_1011.json",
    "results/result_00012_seed_1012.json",
    "rasters/raster_00012_seed_1012.png",
    "cfg/cfg_00012_seed_1012.json",
    "results/result_00013_seed_1013.json",
    "rasters/raster_00013_seed_1013.png",
    "cfg/cfg_00013_seed_1013.json",
    "results/result_00014_seed_1014.json",
    "rasters/raster_00014_seed_1014.png",
    "cfg/cfg_00014_seed_1014.json"
  ],
  "top_level_resources": {
    "partition": "cpu.q",
    "nodes": 1,
    "cores": 2,
    "memory_gb": 16,
    "wall_time_min": 120
  },
  "simulation_job_resources": {
    "partition": "cpu.q",
    "nodes": 1,
    "cores": 8,
    "memory_gb": 32,
    "wall_time_min": 60
  },
  "max_concurrent_simulation_jobs": 2,
  "max_simulation_jobs": 15
}
